,Area,Job_title,Company,Experience,Salary,Location,Description,Tag assosiated,Posting_date
341,Mobile Jobs,Android Developer - Mobile App Architecture,Megma Services,1-4 Yrs,Not disclosed,Mumbai, We are looking for Android Sr Android developer for the Lower Parel (Mumbai) office of ...,"Android Developer, Mobile SDLC, Mobile App Architecture, API, JSON, SDK, Mobile  Architecture, Android",2 Days Ago
342,Mobile Jobs,Mobile Application Developer - Xamarin/phonegap Framework,All About HR Solutions,2-3 Yrs,Not disclosed,Thane," Experience with web technologies: HTML5, CSS, JavaScript, Bootstrap Mobile App Developm...","Hybrid Apps, Java, Xamarin, Phonegap, Javascript, Ionic, Apache, iOS",2 Days Ago
343,Mobile Jobs,Mobile Application Developer - Xamarin/phonegap Framework,All About HR Solutions,2-3 Yrs,Not disclosed,Thane," Experience with web technologies: HTML5, CSS, JavaScript, Bootstrap Mobile App Developm...","Hybrid Apps, Java, Xamarin, CSS, Phonegap, Apache, iOS, Mobile",2 Days Ago
344,Mobile Jobs,Android Developer - Mobile App Architecture,Aadvi Tech. Solutions,1-2 Yrs,Not disclosed,Hyderabad," Must have developed at least 1-2 projects end to end Experience with offline storage, t...","RESTful API, Android Developer, Open Source, Design Patterns, Mobile App Architecture, Mobile App Performance Optimization, SOAP API, SDK",2 Days Ago
345,Mobile Jobs,Mobile Application Developer - Android & iOS,FresherMart,2-5 Yrs,Not disclosed,Noida, 2+ years of hands-on experience in the full life cycle of Hybrid Mobile Application Dev...,"Hybrid Apps, Java, jQuery, Design Patterns, Mobile App Architecture, SWIFT, Objective C, Mobile Ecosystem",2 Days Ago
346,Mobile Jobs,Mobile Developer - Android/ios Platform,EsoTeky Solutions Private Limited,8-10 Yrs,Not disclosed,Noida," Required skills : Extensive knowledge about mobile app design, development and deployme...","Xcode, Redux, Google APIs, Visual Studio, Mobile App Designing, React Native, iOS, Android Studio",2 Days Ago
347,Mobile Jobs,Ionic Developer - Mobile Apps - Xcode/android Studio,Good News Business Solutions LLP,2-6 Yrs,Not disclosed,Mumbai," Required Candidate profileRequired Skills and Qualifications : - HTML, CSS, jQuery, Jav...","AngularJS, REST API, jQuery, Xcode, Javascript, Mobile App Architecture, Ionic, JSON",2 Days Ago
348,Mobile Jobs,Mobile Application Support Engineer - Node.js/react Native,Candela Labs,4-6 Yrs,Not disclosed,Bengaluru," Knowledge on Open Shift Platform(OCP), Docker Containers, Kibana, Kubernetes, etc 4 - 6...","REST API, Native Cloud, performance tuning, Design Patterns, Microservices Architecture, Applications Support, Node.js, MongoDB",2 Days Ago
349,Mobile Jobs,Senior Mobile Application Developer,Torry Harris Business Solutions Pvt Ltd.,6-8 Yrs,Not disclosed,Bengaluru," Hands-on coding, systems analysis, design, and delivery of mobile ap projects, experien...","Core Java, Android Framework, Design Patterns, Android Development, React Native, Android Studio, Threading, IOS",2 Days Ago
350,System Programming Jobs,Opening For C++ Developer(System Programming) with Product Based MNC,Toppersedge.com India Pvt Ltd,2-7 Yrs,Not disclosed,Bengaluru," Experience- 3+ years of experience Skills Required- C++, System programming, Linux/Wind...","System Programming, C++, unix system programming, Multithreading, shell scripting system programming, Linux, Linux system programming, OOPS",4 Days Ago
351,System Programming Jobs,C++ developer(System Programming),Toppersedge.com India Pvt Ltd,2-7 Yrs,"7,00,000 - 15,00,000 PA.",Bengaluru," Job Description Experience- 3+ years of experience Skills Required- C++, System program...","System Programming, C++, unix system programming, Multithreading, Linux, OOPS, linux system programming, Windows",14 Days Ago
352,System Programming Jobs,Principal Engineer / Senior Architect - Systems Programming,Talent Toppers,15-22 Yrs,"35,00,000 - 50,00,000 PA.",Bengaluru," Working experience with hands on experience in C, C++, VC++ (MFC, COMS), Windows Shell ...","System Programming, C++, C, OS, VC++, System Software, Network Programming, .Net",22 Days Ago
353,System Programming Jobs,Java Internals Hard Core Systems Programming,CareerXperts Consulting,15-20 Yrs,Not disclosed,Not specified, • Strong in Software Design and Architecting We would like you to: • Be a senior Java e...,"assembly language, website, C, HTML, ajax, javascript, jquery, SQL",30+ Days Ago
354,System Programming Jobs,Senior CICS System Programmer,DXC Technology India Private Limited,10-20 Yrs,Not disclosed,"Chennai, Bengaluru, Hyderabad"," Experience in problem determination, performance tuning, setting security and web enabl...","System Programming, Cics System Programmer, vsam system programmer, cobol system programmer, jcl system programmer, cobol z / os, db2 system programmer",3 Days Ago
355,System Programming Jobs,Cics System Programmer,DXC Technology India Private Limited,5-10 Yrs,Not disclosed,"Chennai, Bengaluru, Hyderabad"," Experience in problem determination, performance tuning, setting security and web enabl...","System Programming, Cics System Programmer, vsam system programmer, cobol system programmer, jcl system programmer, cobol z / os, db2 system programmer",4 Days Ago
356,System Programming Jobs,DB2 System Programmer,DXC Technology India Private Limited,10-20 Yrs,Not disclosed,"Chennai, Bengaluru, Hyderabad"," Good knowledge in performance & tuning, database sizing, system support, security and d...","System Programming, Db2, Z / OS, Disaster Recovery, Performance Tuning, System Support",4 Days Ago
357,System Programming Jobs,Z/OS System Programmer,DXC Technology India Private Limited,5-10 Yrs,Not disclosed,"Chennai, Bengaluru, Hyderabad", Required Candidate profileGood knowledge of system initialization and tuningGood Knowle...,"cics system programmer, z / os, system programming, clist, rexx, z / directory, cics, assembler",4 Days Ago
358,System Programming Jobs,C++ Developer(embedded),Toppersedge.com India Pvt Ltd,2-7 Yrs,"7,00,000 - 17,00,000 PA.",Bengaluru, Job description: We have openings for C++ Developers with experience into C++ Developme...,"Product Development, System Programming, C++, c++ programmer, C++ developer, Embedded Systems, c++ program, Kernel Programming",9 Days Ago
359,System Programming Jobs,"Server Core Engineer (C Programming, Distributed Systems) @ Bangalore",iglance Systems LLP,3-8 Yrs,Not disclosed,Bengaluru," Minimum QualificationsProficient at programming in C, and highly versant in at least on...","distributed database, C, distributed storage, Server product development, Threading, distributed computing, Server side development, clustered system",30+ Days Ago
360,System Programming Jobs,Software Senior Engineer,Secureworks,3-5 Yrs,Not disclosed,Bengaluru, Dell provides the technology that transforms the way we all work and live. But we are m...,"Computer science, C++, Linux, Networking, HP data protector, System programming, Machine learning, Data structures",30+ Days Ago
361,System Programming Jobs,Principal Technical Specialist,Nokia Solutions and Networks India (P)Ltd.,2-3 Yrs,Not disclosed,Bengaluru," As a key member of the ION SRPG team, you will be designingplatforms and systems softwa...","C++, Optical networking, USB, System programming, Data structures, PCIE, MIPS, ARM",30+ Days Ago
362,System Programming Jobs,System Developer,T & A Solutions,2-5 Yrs,Not disclosed,Mohali," System Developer Posted on -October 24, 2017 Designation System Developer Experience 2 ...","Electrical engineering, continuous integration, server, development, c, Networking, technical, software",30+ Days Ago
363,System Programming Jobs,Android Developer,Dex Consulting,2-5 Yrs,Not disclosed,india, Gather requirements around functionality and translate those requirements into elegant ...,"development, interfaces, software, Eclipse, System programming, android, Programming, mobile",30+ Days Ago
364,System Programming Jobs,Network Engineer,Dexel Designs Pvt Ltd,2-7 Yrs,Not disclosed,Bengaluru, Expert in C programming Expert in Linux Kernel/ internal/ File system Programming. Good...,"NAT, C, Networking, Linux kernel, Ethernet, System programming, Protocol stack, linux",30+ Days Ago
365,System Programming Jobs,Software Engineer / Leading Engineer - VC + + MFC,Angel & Genie,6-11 Yrs,Not disclosed,Bengaluru," Job Responsibilities: Architecting, Designing and Developing Tools & GUI based applicat...","Computer science, Object oriented design, Image processing, Wordpress, Opengl, System programming, Windows, MFC",30+ Days Ago
366,System Programming Jobs,C Developer / Sr Developer,Diverse Lynx India Pvt. Ltd,3-7 Yrs,Not disclosed,Bengaluru, Required Skills Qualifications Should be well versed with C programming Language on Lin...,"Multithreading, Linux, OOPS, System programming, Data structures",30+ Days Ago
367,System Programming Jobs,GPU Engineer,Mantis HR Consulting,3-5 Yrs,Not disclosed,Bengaluru, Job Description Minimum of 2 year experience in system programming for Embedded Linux M...,"RTOS, Algorithms, Debugging, System programming, Embedded Linux, DTV, Data structures, H264",30+ Days Ago
368,System Programming Jobs,Linux Developer,HR Devi and Associates,2-4 Yrs,Not disclosed,Gurgaon, C With Linux Developer Job Description Job Description - Excellent C Programming Skills...,"Multithreading, linux development, OS internals, Analytical, Debugging, System programming, Remote desktop, Programming",30+ Days Ago
369,System Programming Jobs,Sr . Software Engineer,Hyrefox,5-10 Yrs,Not disclosed,Bengaluru, Requirement: 5 to 12 yrs of related industry experience developing system software usin...,"Linux, IXIA, Ethernet, Debugging, System programming, Kernel programming, PCIE, System software",30+ Days Ago
370,EDP Jobs,EDP EXECUTIVE,BINOD HYUNDAI,1-3 Yrs,Not disclosed,Angul," Functional Area: WORD, EXCEL, PHOTOSHOP Qualification Required: MUST BE GRADUATE Experi...","Excel, Executive EDP, Billing, Photoshop",30+ Days Ago
371,EDP Jobs,EDP - Executive,Max MRO Services Pvt. Ltd,3-8 Yrs,Not disclosed,Mumbai," •Regular reports to the Management outlining progress, project risks, and any additiona...","Team management, Aviation, Networking, Executive EDP, Relationship, Hardware, Vendor, Software implementation",30+ Days Ago
372,EDP Jobs,EDP Operator,WSD Consultant,0-15 Yrs,Not disclosed,"Gurgaon, Noida", Controls the paper making software and prepares all printing materials. Controls other ...,"Printing, Training, Accessories, EDP Operator, Database management, System support, Database management system, Counselling",30+ Days Ago
373,EDP Jobs,Edp Executive,Sunil Manpower Services,1-3 Yrs,Not disclosed,"Mumbai, Thane", We Required Urgently Edp Executive Profile. . . . . Edp Executive Mis Share with Vendor...,"assembly language, C, EDP Executive, HTML, SQL, EDP Officer, Six Sigma",30+ Days Ago
374,EDP Jobs,Edp Head,Sunil Manpower Services,3-6 Yrs,Not disclosed,Mumbai, We Required Urgently Edp Head for Courier Company At Mahakali Caves Road Andheri East W...,"EDP Officer, EDP Incharge, EDP Executive, EDP Assistant, EDP Head, EDP Manager",30+ Days Ago
375,EDP Jobs,EDP - EXECUTIVE,Saphire Honda,1-6 Yrs,Not disclosed,Bengaluru, EDP-EXECUTIVE Job Description - Training new staff existing on the entire process produ...,"Product training, Training Executive, Executive EDP, Database, PUC",30+ Days Ago
376,EDP Jobs,EDP Executive,TVE Certification Services Pvt. Ltd.,2-7 Yrs,Not disclosed,Trichy," 4. JOB TITLE : EDP ExecutiveNo. of Vacancies??? : 01 Location?????????? : Trichy, Tamil...","DTP, Software packages, Excel, Executive EDP, Corel Draw, adobe, Desktop publishing, Photoshop",30+ Days Ago
377,EDP Jobs,EDP -  Executive,Max MRO Services Pvt. Ltd,3-8 Yrs,Not disclosed,Mumbai," Regular reports to the Management outlining progress, project risks, and any additional...","software implementation, systems software, vendor, setup, aviation, team management skills, decision maker, maintenance",30+ Days Ago
378,EDP Jobs,Assistant / Deputy Manager - EDP,THE GLOBAL ZONE HR SERVICES,5-10 Yrs,"4,00,000 - 6,00,000 PA.",Rewari, Should have the certification in ABAPEngineering Graduates / MCAShould have at least 5 ...,"EDP, SAP, Inventory Management, Materials, ABAP",30+ Days Ago
379,EDP Jobs,EDP Incharge ,mycitypune,3-4 Yrs,Not disclosed,Pune, Candidate should have experience in the same field for 3- 4 years. Salary : No bar for ...,"assembly language, JavaScript, Real Time Operating Systems, .NET, HTML, Oracle, SQL",30+ Days Ago
380,EDP Jobs,EDP Manager,mycityband,3-5 Yrs,Not disclosed,"Ahmedabad, Hyderabad", Candidate should be MCA / B.Tech / equivalent with 3 - 5 Years of experience in IT indu...,Export import,30+ Days Ago
381,EDP Jobs,EDP Executive,Aakash Institute,8-12 Yrs,Not disclosed,Delhi, Graduate with prior experience in desktop publishing;Analyzing data and make reports as...,"Data analysis, Software packages, VLOOKUP, Corel Draw, Desktop publishing, Advanced Excel, MS Word, Photoshop",30+ Days Ago
382,EDP Jobs,IT Head/manager,Signature HR services,10-15 Yrs,"20,00,000 - 25,00,000 PA.",Mumbai," Manage information technology and computer systems Design, develop, implement and coord...","Head IT Infrastructure, BCA, EDP Management, Computer Science, Computer, it manager, MCA, IT Infrastructure Management",19 Days Ago
383,EDP Jobs,MIS Manager,Paragon Digital Services Pvt Ltd,10-15 Yrs,Not disclosed,Chennai, Responsibilities Must have had 10+ yrs of experience in managing MIS / PMO function for...,"PMP, Due diligence, Process mapping, Transition management, Transition, ITES, Digital marketing, Stakeholder management",None
384,EDP Jobs,Incident Management,Capgemini Technology Services India Limited,4-6 Yrs,Not disclosed,Pune, Experience: 4-6 Years,"IT services, Change management, Service level, IT infrastructure, Incident management, Management, Business intelligence",None
385,EDP Jobs,Data Engineer - AI,Snaphunt,0-5 Yrs,Not disclosed,"Delhi NCR, Mumbai, Bengaluru", You have prior experience within a Data Engineer or similar roleDemonstrated experience...,"Creative Solutions, Algorithms, Scalability, Artificial Intelligence, Computer Science, Neural Networks, Big Data, Applied Mathematics",2 Days Ago
386,EDP Jobs,Devops Engineer (kubernetes),Snaphunt,3-8 Yrs,Not disclosed,Bengaluru," You have at least 3 years experience, ideally within a Software Engineer roleBuilding t...","Technical Documentation, Business Intelligence, Customer Experience, Software Engineering, Continuous Improvement, Computer Science, Digital Transformation, System Troubleshooting",2 Days Ago
387,EDP Jobs,Cloud Infrastructure Administrator,VMware India,5-8 Yrs,Not disclosed,Bengaluru, ? Work on Weekends and Rotating shift? Frequent contact with managerRequirements:? Upco...,"Computer science, Automation, Production support, Disaster recovery, Perl, HTTP, Windows, Firmware",None
388,EDP Jobs,Business Systems Consultant 3,Wells Fargo India Solutions Pvt. Ltd.,7-10 Yrs,Not disclosed,Bengaluru, About the role This role will support the Corporate Asset Liability Management Team wit...,"Stress testing, Automation, Data management, Production support, Asset liability management, Information security, Analytical, Data structures",3 Days Ago
389,EDP Jobs,Valeo Production System Engineer,Valeo India Pvt Ltd,8-10 Yrs,Not disclosed,Chennai, VPS Engineer / Technician is in charge of monitoring the internal production standards ...,"Kaizen, Incharge, Deployment, Management, Continuous improvement, Monitoring, Principal",4 Days Ago
390,Telecom Software Jobs,Telecom Software & Networking,cyborg technology,2-7 Yrs,Not disclosed,"Greater Noida, Noida"," Job Description SS7 , Switching Software , TMN , SNMP , Q3 , TCP / IP , CTI , ATM , RIP...","GSM, Telecom, TDMA, Networking, SS7, ISDN, WAP, SNMP",30+ Days Ago
391,Telecom Software Jobs,Telecom Software & Networking,cyborg technology,2-7 Yrs,Not disclosed,Noida," Telecom Software & Networking - SS7, Switching Software, TMN, SNMP, Q3, TCP/ IP, CTI, A...","gsm, nms, isdn, sdh, ss7, wap, cti, telecom",30+ Days Ago
392,Telecom Software Jobs,VP Engineering Software - Telecom & Mobility Products & Services,GlobalReach Div. Of Outreach Consultants Pvt. Ltd,17-25 Yrs,"50,00,000 - 1 Cr and above PA.",Pune," Would head the company's software development, new product development & production & c...","cloud bases data systems, erp, process improvement, cloud platforms, enterprise integration, sentinal, automation, mobility services",15 Days Ago
393,Telecom Software Jobs,Software Engineer for Telecom,SR Expert Services,3-6 Yrs,Not disclosed,Delhi, Urgent Hiring for Software Engineer for Telecom Profile - Software Engineer for Telecom...,"NMS and IPSMGW For monitoring and Trouleshooting, ONU Designing & Programming, Putty and wireshark software for configuration and Trouleshooting, G-Pon & E-Pon Technologies, AMS, RIP, Tools: linex/unix",30+ Days Ago
394,Telecom Software Jobs,Senior Software Engineer - Java/telecom,Mavenir Systems Pvt Ltd,5-10 Yrs,Not disclosed,Bengaluru(Hebbal), Qualification: B Tech / MCA from reputed college with minimum 6 years of relevant exper...,"Gateways, Spring Boot, HTTP, Spring, SOAP, Core Java, MMS, Design Development",30+ Days Ago
395,Telecom Software Jobs,Software Developer - Telecom Industry,HR Devi and Associates,3-5 Yrs,Not disclosed,Bengaluru," Job Description 1. Strong hands on experience in C, C programming in Linux operating sy...","Technical product configuration, c++, C, design, MySQL, JavaScript, integration PHP, HTML",30+ Days Ago
396,Telecom Software Jobs,Software Developer - Telecom Industry,HR Devi and Associates,3-5 Yrs,Not disclosed,Bengaluru," Job Description 1. Strong hands on experience in C, C programming in Linux operating sy...","Technical product configuration, c++, C, design, MySQL, JavaScript, integration PHP, HTML",30+ Days Ago
397,Telecom Software Jobs,Senior C Developer,Oracle India Pvt. Ltd.,6-10 Yrs,Not disclosed,Bengaluru, Bachelors or MCA equivalent engineering / computer science education spanning 4 yearsEx...,"c software developer, c++, oracle, C, c / c++ developer, c programmer, telecom protocols, cam",10 Days Ago
398,Telecom Software Jobs,Senior Technical Leader | Telecom | Test Case Development,El Dorado Services,7-12 Yrs,Not disclosed,Bengaluru, Engineering/ science degree or equivalent academic qualifications/ experience;7 years o...,"development, channel partners, professional s, 3g, academic, telecom, lte, software programming",30+ Days Ago
399,Telecom Software Jobs,Software Customer Support Protocol High Layers,itForte Staffing Services Private Ltd.,3-8 Yrs,Not disclosed,Delhi, Keep up-to-date on platform knowledge and methodologies REQUIREMENTS: Professional skil...,"RTOS, GSM, Telecom, JTAG, Software configuration management, Debugging, Customer support, GPRS",30+ Days Ago
400,Telecom Software Jobs,VoIP / Asterisk SIP Developer,OnlineVoIP Solutions Pvt. Ltd.,3-5 Yrs,Not disclosed,Ahmedabad, VOIP software development - Asterisk development experience - SIP Development experienc...,"development, software, VOIP, professional services, it, Information technology, Telecom, phone",30+ Days Ago
401,Telecom Software Jobs,VoIP / Asterisk / SIP Developer,OnlineVoIP Solutions Pvt. Ltd.,2-7 Yrs,Not disclosed,Ahmedabad," If you are a Asterisk Developer with VOIP Developer and SIP Developer experience, pleas...","development, software development, information technology, software, asterisk, pbx, it, experience",30+ Days Ago
402,Telecom Software Jobs,Software Customer Support Protocol High Layers,itForte Staffing Services Private Ltd.,3-8 Yrs,Not disclosed,Delhi, Keep up - to - date on platform knowledge and methodologies REQUIREMENTS: Professional ...,"GSM, RTOS, Telecom, English, Software configuration management, Technical skills, Service, Customer support",30+ Days Ago
403,Telecom Software Jobs,Module Lead - Network Planning Software - React UI,Ciena India Private Ltd.,5-10 Yrs,Not disclosed,Gurgaon, The successful candidate will be expected follow a disciplined approach to software dev...,"Telecom, Linux, Networking, MySQL, Javascript, Agile, Data structures, Troubleshooting",30+ Days Ago
404,Telecom Software Jobs,Telecom Billing Expert,Right Step Consulting,10-15 Yrs,Not disclosed,Gurgaon, Job Description Role purpose: To provide Technical Leadership on Proactive Operational ...,"Unix, Telecom, XML, Billing, PLSQL, Perl, DBMS, Oracle 10G",30+ Days Ago
405,Telecom Software Jobs,Junior Engineer Trainee-Telecom,Right Step Consulting,0-1 Yrs,Not disclosed,Delhi, Additional Information Salary: Not Disclosed by Recruiter Industry:IT- Software / Softw...,"Telecom, Networking, Layout, Junior Engineer Trainee, Technical, Ethernet, Software, OSP",30+ Days Ago
406,Telecom Software Jobs,Senior Software Engineer /technical Lead - 3g-umts/4g-lte Testing,Triadss Tech Solutions,5-8 Yrs,Not disclosed,Chennai, Senior Software Engineer /Technical Lead - 3G-UMTS/4G-LTE Testing & Support Excellent O...,"UMTS, 4G, eNodeB, 3G, Technical Support, Telecom Testing, Cisco ios, LTE",30+ Days Ago
407,Telecom Software Jobs,VoIP / Asterisk / SIP Developer,OnlineVoIP Solutions Pvt. Ltd.,2-5 Yrs,Not disclosed,Ahmedabad, Job Description : VOIP software development - Asterisk development experience - SIP Dev...,"development, software development, information technology, software, asterisk, pbx, it, experience",30+ Days Ago
408,Telecom Software Jobs,"Software Development Engineer ,  Senior",CSG International,7-10 Yrs,Not disclosed,Bengaluru," 15741 Software Development Engineer , Senior (Open) Position Type: Full time Location(s...","Unix, Software development methodologies, development, technical, software, administration, testing, test driven development",30+ Days Ago
409,Telecom Software Jobs,Genesys Developer - Cisco & Avaya Platform,Anbiya Technologies,5-9 Yrs,Not disclosed,Bengaluru, Required Skills : - 5 to 8 years of experience years of professional experience in soft...,"Telecom, IP Telephony, software development, Inbound Voice, Cisco, Genesys, T - ServerSIP, Troubleshooting",30+ Days Ago
410,Telecom Jobs,Telecom Engineer_AIROLI,Trigent Software Limited,1-3 Yrs,"2,50,000 - 4,50,000 PA.",Mumbai, Shifts: Rotational including night shift(2 way cab is provided)We are also a Microsoft ...,"night shift, revenue assurance, rf engineering, software development, management skills, effective communication skills, telecom billing, ms office",None
411,Telecom Jobs,Telecom/network Solution Architech-telecom/network Solutioning,Accenture Solutions Pvt Ltd,1-3 Yrs,Not disclosed,Mumbai, Job Summary You will be aligned with our Solution Architecting vertical and help us int...,"Telecom, Automation, SAS, Networking, Manager Technology, Sales process, Individual Contributor, Business case",4 Days Ago
412,Telecom Jobs,Telecom/network Solution Architech-telecom/network Solutioning,Accenture Solutions Pvt Ltd,7-8 Yrs,Not disclosed,Noida," You should drive true solution differentiation through automation, analytics, liquid, c...","Telecom, Automation, SAS, Networking, Senior management, Billing, Sales process, Management",9 Days Ago
413,Telecom Jobs,Telecom/network Solution Architech-telecom/network Solutioning,Accenture Solutions Pvt Ltd,3-5 Yrs,Not disclosed,Mumbai, Job Summary You will be aligned with our Solution Architecting vertical and help us int...,"Telecom, Automation, SAS, Networking, Senior Analyst, Manager Technology, Sales process, Individual Contributor",9 Days Ago
414,Telecom Jobs,Drive Test Engineer,Innovis Telecom Services Pvt Ltd,3-6 Yrs,Not disclosed,Gurgaon, Must be willing to travel for long periods stretching 6 months;Job Experience : Must ha...,"GSM, Telecom, Actix, 3G, Drive test tool, Telecommunication, RF planning, Test planning",30+ Days Ago
415,Telecom Jobs,Power BI Developer with a Telecom Company For a contract of 3-5Months,Lobo Staffing Solutions Private Limited,2-4 Yrs,"3,50,000 - 4,75,000 PA.",Delhi, Need to have experience in creating calculated measures and columns with DAX in MS Powe...,"mdx, microsoft power bi, BSS, ssas, olap, dax, power bi desktop, cube",9 Days Ago
416,Telecom Jobs,QA and Support Engineer- Telecom,Client Of Sampoorna,1-3 Yrs,Not disclosed,Noida," Candidate Experience Should Be : 1 To 3 Candidate Degree Should Be : BE-Comp / IT, BE-O...",Support and Commissioning,12 Days Ago
417,Telecom Jobs,Signaling & Telecom Engineer,EGIS India Consulting Engineers Pvt. Ltd.,8-13 Yrs,Not disclosed,Kolkata, Required fields Civility Sir Madam Name First name Email Country - None - Afghanistan A...,"GIS, Telecom, French, Aviation, WAN, Project management, Telecommunication, Data mining",30+ Days Ago
418,Telecom Jobs,TELECOM ENGINEER,Foundation Manpower Management,0-4 Yrs,Not disclosed,Kolkata," Job Responsibility : 1. Design, install & troubleshoot the telecommunication systems. 2...","Telecom, Hardware networking, Manpower management, C, Networking, Transmission, Telecommunication, Hardware",30+ Days Ago
419,Telecom Jobs,Telecom Engineer - Saudi Arabia,Confidential,7-12 Yrs,"20,00,000 - 25,00,000 PA.",Saudi Arabia," Must have good communicationMust have experience in Network NB-IoT, LoraWAN, etc","telecommunication engineering, nb - iot, lorawan, telecom engineering",30+ Days Ago
420,Telecom Jobs,IP Network Planning & Optimization Engineer,Innovis Telecom Services Pvt. Ltd.,5-9 Yrs,Not disclosed,Bengaluru," Network Planning of Products like Cisco, Juniper, Huwai, ( routers/ Switches, Firewall)...","optimization, firewall, switches, troubleshooting, telecom, ccna, routers, cisco",30+ Days Ago
421,Telecom Jobs,Responsibility Matrix - Engineer DT,Telecom Network Solutions Pvt Ltd.,0-2 Yrs,Not disclosed,other location, 1.0 Purpose : To complete the drive test and analysis of test log 2.0 Objective : To co...,"GSM, Telecom, EMF survey, 4G, 3G, Microwave, Radio, LTE",30+ Days Ago
