,Area,Job_title,Company,Experience,Salary,Location,Description,Tag assosiated,Posting_date
501,Maintenance Jobs,State Core Maintenance Engg Fibre,Reliance Jio Infocomm Limited,5-10 Yrs,Not disclosed,Dhule," 1. Manage assets, materials and contracts for the core maintenance point 2. Monitor per...","Warehouse, Network operations, Electronics, Issue resolution, environment health safety, Management, Troubleshooting, OFC",2 Days Ago
502,Maintenance Jobs,Maintenance Manager,Smart Joules,10-15 Yrs,Not disclosed,"Delhi, Hyderabad"," Summary: As Maintenance Manager, you will spend time interacting with the COO, Site Ene...","HVAC, Networking, Instrumentation, Saving, Sensors, Medical insurance, Automation systems, Troubleshooting",2 Days Ago
503,Maintenance Jobs,Maintenance Manager,Reliance Jio Infocomm Limited,10-15 Yrs,Not disclosed,"Kolkata, chhattisgarh", 1. Maintain and update the asset master 2. Monitor performance of the vendors against d...,"SAP PM, Interpersonal skills, Team management, Process orientation, Network infrastructure, Network operations, environment health safety, Network management",3 Days Ago
504,Maintenance Jobs,Maintenance Manager,Reliance Jio Infocomm Limited,10-15 Yrs,Not disclosed,"azamgarh,uttar pradesh", 1. Maintain and update the asset master 2. Monitor performance of the vendors against d...,"SAP PM, Interpersonal skills, Team management, Process orientation, Network infrastructure, Network operations, environment health safety, Network management",3 Days Ago
505,Maintenance Jobs,Maintenance Head,KAN BIOSYS PRIVATE LIMITED,7-10 Yrs,"4,50,000 - 7,00,000 PA.",Pune(Dhayari), Supervise and lead all maintenance processes and operations. Track expenses and oversee...,"Installation, Maintenance, Cost Estimation, Repair, Machinery",2 Days Ago
506,Maintenance Jobs,section Rolling Mill - Electrical Maintenance Engineer,Viraj Profiles Ltd,3-8 Yrs,Not disclosed,Tarapur," Should handover Multi meters, Clamp meters, Thermometer & shift key to the next concern...","ac drives, rcs, stainless steel, plc, channel, profiles, long product, siemens s7",3 Days Ago
507,Maintenance Jobs,Maintenance Superintendent,Power Mech Projects Limited,10-15 Yrs,Not disclosed,Iraq," Bachelor in industrial engineering (Mechanical, Electrical or equivalent)Coordination o...","o&m manager, Gas Turbine Generators, Open Cycle Power Plant, Operation Maintenance Manager, Maintenance Activities",3 Days Ago
508,Maintenance Jobs,Executive- Analytical Instrument Maintenance,Pfizer,5-6 Yrs,Not disclosed,Chennai," Through Knowledge on Good Manufacturing Practices (cGMP), and Good Documentation Practi...","Preventive Maintenance, UPLC, cGMP, Manufacturing, GC, statutory audits, maintenance, HPLC",4 Days Ago
509,Maintenance Jobs,Area Engineer - Mechanical Maintenance,Nayara Energy Limited,4-7 Yrs,Not disclosed,Vadinar," Responsible to make availability of Normal, Emergency and Critical Power at Jetty. Resp...","Procurement, Auditor, ISO, Compliance, Mechanical maintenance, ISO audit, Budgeting, Refinery",4 Days Ago
510,Logistics Jobs,"Warehouse & Logistics Manager,",Agarwal Logistics (P) Ltd,10-15 Yrs,"3,50,000 - 5,00,000 PA.",Patna, NEED WAREHOUSE AND LOGISTICS MANAGER,"Warehouse, Logistics Management",7 Days Ago
511,Logistics Jobs,Lead Buyer - Transportation and Logistics,Alstom Transport India Ltd.,10-15 Yrs,Not disclosed,Bengaluru, Job Description:Managing Sourcing process for Indirect Services spend for multiple proj...,"Procurement, Import, International Freight Forwarding, Vendor Management, Supply Chain Management, Indirect Sourcing, SCM, Buyer Activities",3 Days Ago
512,Logistics Jobs,Warehouse & Logistics Manager,Saa Vishnu Bakers Private Limited,1-3 Yrs,"4,00,000 - 5,00,000 PA.",Gaya," Bachelors degree in supply chain management, operations, logistics, business administra...","logistics management, customer satisfaction, Site Supervision, Computer Operating, metrics reporting, warehouse, inventory management, Excel Report Preparation",None
513,Logistics Jobs,Logistics Manager,Grozip,4-5 Yrs,Not disclosed,Bhubaneshwar," 4-5 years of experience in a similar function at a logistics / courier company, retail ...","Supply chain, CVS, Retail, SAP, Customer support, Logistics management, FMCG, Warehouse operations",9 Days Ago
514,Logistics Jobs,Logistics executive,Seven Consultancy,4-8 Yrs,Not disclosed,Chennai, JOB DETAILS 1.Should Be Able to Arrange Trucks for 3rd Party Logistic Movements Across ...,"Supply chain management, Logistics Executive, export logistics, Sales coordination, Packaging, Transport management, Logistics management, Import logistics",12 Days Ago
515,Logistics Jobs,Senior Manager Logistics,H & S Supply Chain Services Private Limited,9-14 Yrs,"12,00,000 - 15,00,000 PA.",Chennai(Mylapore), Performance Objectives Deliver Sizeable cost savings on Freight Build Indepth networkin...,"vendor development and sales, logistics and sales, courier, Transportation, freight, supply chain management and sales, Senior Management, cargo",15 Days Ago
516,Logistics Jobs,Manager - Supply Chain/logistics,Oswal Minerals,5-10 Yrs,Not disclosed,Dubai, Logistics Manager and Supply chain Management with experience of 5-10 years LC knowledg...,"Custom Documentation, Logistics management, Shipping, Supply Chain, Operations, Freight, Logistics",2 Days Ago
517,Logistics Jobs,Assistant Logistics Manager  -  Import,RAJ PETRO SPECIALITIES PVT LTD.,7-10 Yrs,Not disclosed,Mumbai, YOUR ROLE & RESPONSIBILITIES Applicants are invited for the position of Assistant Logis...,"import purchase, Supply chain management, Head Business Development, Custom clearance, Logistic Assistant, SAP, Compliance, SEZ",None
518,Logistics Jobs,Assistant Logistics Manager  -  Import,BRENNTAG INGREDIENTS (INDIA) PRIVATE LIMITED,7-10 Yrs,Not disclosed,Mumbai, YOUR ROLE & RESPONSIBILITIES Applicants are invited for the position of Assistant Logis...,"import purchase, Supply chain management, Head Business Development, Custom clearance, Logistic Assistant, SAP, Compliance, SEZ",None
519,Logistics Jobs,Logistics and Customer Services Manager,GlaxoSmithKline Pharmaceuticals Limited,3-5 Yrs,Not disclosed,riga, Why this role Are you interested to have both technical and people orientated role Do y...,"Procurement, Networking, Pharma, Analytical, Healthcare, HR, Customer service, Warehouse management",3 Days Ago
520,Logistics Jobs,Logistics Head For FMCG Company - Madurai Location,Jayakrishna Flour Mills Pvt Ltd,10-15 Yrs,Not disclosed,Madurai," Mail id not required, on clicking apply option automatically resume will reach usNegoti...","Work Allocation, Management Reporting, logistics head, supply chain head, Preventive Maintenance, Data Management",3 Days Ago
521,Logistics Jobs,Logistics Operation Assistant,Pioneer Management Consultant Pvt. Ltd.,2-7 Yrs,Not disclosed,"Navi Mumbai, Mumbai"," & Location: Juinagar Criteria : Bachelor degree or above in logistics, supply chain or ...","Supply chain, MIS reporting, Outbound, Payroll, SAP, SPR, MIS, Logistics operations",9 Days Ago
522,Logistics Jobs,Supply Chain And Logistics Officer,SR Expert Services,4-6 Yrs,Not disclosed,Delhi, Job Description Urgent Hiring for Supply Chain and Logistics Officer profile - Supply C...,"Report generation, Supply chain management, Accounting, Business management, Logistics management, Legal documentation, Management, Inventory",9 Days Ago
523,Logistics Jobs,Hiring! Head of Logistics- Slaney Healthcare Pvt. Ltd.,Shalby Limited,8-13 Yrs,"5,00,000 - 8,00,000 PA.",Ahmedabad, Build and maintain good relationships with vendorsExperience: 5 to 10 Years from Health...,"logistics Head, supply chain, supply chain management, logistics, Logistics Management",11 Days Ago
524,Logistics Jobs,Inbound Logistics,Hero MotoCorp Ltd.,15-19 Yrs,Not disclosed,Gurgaon, Should also be having exposure of Rail / Water ways & International Logistics & should ...,"Air Freight, international logistics, digital manufacturing, program management, warehouse, analytical skills, process flow, 3pl",11 Days Ago
525,Logistics Jobs,Executive / Sr. Executive - Logistics,Neptunus Power Plant Services Pvt. Ltd.,2-4 Yrs,"2,50,000 - more than 3,00,000 PA.",Navi Mumbai, He will get a hands on experience on Logistics,"inventory control, material management, warehouse management, store management, Logistics Management, inventory management, Export Import",15 Days Ago
526,Logistics Jobs,Zonal Head - Operations/logistics,DGC Group,6-8 Yrs,Not disclosed,Ahmedabad, Ensure all MIS and dashboards for all business lines should be readily available to kee...,"Logistics management, Operations, Channel Support, sales, Logistics",3 Days Ago
527,Logistics Jobs,Sr . Executive Logistics,Harsha Fibers & Composites Private Limited (Harsha Group),7-12 Yrs,"3,50,000 - 4,75,000 PA.",Chennai, Looking for a young and energetic Male Candidate for the post of Sr. Executive Logistic...,"imports, Logistics Executive, shipping, Logistics Operations, Exports, Logistics",5 Days Ago
528,Logistics Jobs,"Associate, SC - Logistics",Baxter Pharmaceuticals India Private Limited,1-6 Yrs,Not disclosed,Ahmedabad, Good Co-Ordination & command over English Language,"SAP, Shipment, Export, Insurance Processing, Shipping, Logistics Planning, Logistics Operations, English Language",11 Days Ago
529,Logistics Jobs,Logistics Clerks,Technology Exchange Services,3-4 Yrs,Not disclosed,Ahmedabad, Job Description Graduate with 3-4 years of experience of retail transport industry and ...,"Retail, MS Office, Logistics Clerk, Logistics",11 Days Ago
530,Sales Jobs,Sales Manager - US Recruitments,Lotus TP Inc,5-10 Yrs,Not disclosed,Trichy," Trichy, TN (Can work from home or Anywhere in India)Analyze requirements from clients /...","sales management, account development, relationship building, sales recruitment, client servicing, it consulting, us staffing, business development",23 Days Ago
531,Sales Jobs,Sales Manager (corporate Sales)- Hospitality - Corporate Housing,Lotus Suites USA,5-10 Yrs,Not disclosed,Bengaluru, A fast upcoming Corporate housing provider in USA with prime vendorship with Fortune 50...,"sales management, travel management, lead generation, hospitality, hotel, Corporate Travel Management, corporate sales, business travel management",23 Days Ago
532,Sales Jobs,Deputy Regional Manager - Mortgage Sales ( Coimbatore ),HDFC Sales Pvt. Ltd,13-15 Yrs,"10,00,000 - 14,00,000 PA.",Coimbatore, Sales Review Meet - SSR strategy meeting - BSA strategy meeting - Hiring & Retention st...,"marketing, sales review, Housing Loan, market intelligence, Sales, team management, relationship management, Home Loans",12 Days Ago
533,Sales Jobs,Sales Officer,Louis Unisex Salon & Spa,5-10 Yrs,Not disclosed,solan, Contact businesses and private individuals by telephone to promote products and service...,"Procurement, Telecom, Sales, Billing, Customer service, Operations, Cost, Marketing strategy",None
534,Sales Jobs,Deputy Manager Sales,Ingram Micro (I) Pvt Ltd,2-7 Yrs,Not disclosed,Madurai, You will need to be technology graduate with minimum 3 years experience in IT salesWork...,"marketing, sales management, customer relationship, relationship management, business development, selling, accounting, it sales",2 Days Ago
535,Sales Jobs,Deputy Manager Sales,Ingram Micro (I) Pvt Ltd,2-7 Yrs,Not disclosed,Trivandrum, You will need to be technology graduate with minimum 3 years experience in IT salesWork...,"marketing, sales management, customer relationship, relationship management, business development, selling, it sales",2 Days Ago
536,Sales Jobs,Deputy Manager Sales,Ingram Micro (I) Pvt Ltd,2-7 Yrs,Not disclosed,Chennai, You will need to be technology graduate with minimum 3 years experience in IT salesWork...,"marketing, sales management, customer relationship, relationship management, business development, selling, it sales",2 Days Ago
537,Sales Jobs,"Integreon-hiring For ""data & Project Manager, Sales Enablement""",INTEGREON MANAGED SOLUTIONS INDIA PVT LIMITED,10-13 Yrs,Not disclosed,Noida(Sector-127 Noida)," Job Description - Data & Project Manager, Sales Enablement Who we are: Integreon is a t...","pre - sales, salesforce.com data, presales, manager presales, bid management, marketing, manager rfp, salesforce data",None
538,Sales Jobs,Executive - Business Development - Sales & Marketing,Excelsior Organisation,0-2 Yrs,Not disclosed,Mumbai, Freshers Can Apply Business Management Freshers Marketing Freshers Mba / pgdm Freshers ...,"Community Management, Sales, Event Management, Sales Strategy, Client Services, Campaign Management, Marketing",2 Days Ago
539,Sales Jobs,International Sales & Marketing Role,Advids.co,0-2 Yrs,Not disclosed,Pune, Required Candidate profileDesired Skills and Experience : - Effective Communication and...,"International Sales, Sales, International Marketing, Marketing Services Sales, Business Development, B2B Sales, Solutions Sales, Marketing",2 Days Ago
540,Sales Jobs,Territory Manager - Corporate Sales - Employee Benefit Solutions,Megma Services,0-1 Yrs,Not disclosed,"Chennai, Pune", MBA Marketing - Freshers are also welcome to apply Management reporting as per requirem...,"Business Acquisition, Key Accounts, Market Share, Concept Sales, Business Development, Corporate Sales, Revenue Generation, Territory Management",2 Days Ago
541,Sales Jobs,Territory Manager -corporate Sales/business Development/concept Sales,Megma Services,0-1 Yrs,Not disclosed,"Chennai, Bengaluru", MBA Marketing - Freshers are also welcome to apply Management reporting as per requirem...,"Business Acquisition, Key Accounts, Concept Sales, Business Development, Corporate Sales, Revenue Generation, Territory Management, Marketing",2 Days Ago
542,Sales Jobs,Intern - Sales Management - Voucher/gift Card,Megma Services,0-1 Yrs,Not disclosed,"Ahmedabad, Jaipur", The client is looking for Sales officer - Intern ( Corporate Sales) for Jaipur & Ahmeda...,"Business Acquisition, Relationship Development, Cross Selling, Key Accounts, Business Development, Sales Management, Corporate Sales, Revenue Generation",2 Days Ago
543,Sales Jobs,Coordinator/assistant Manager - Sales - Chemical,The Perfect 1/One Search,0-1 Yrs,Not disclosed,Noida, Work experience -Fresher Basic UG qualification (UG - Any Graduate - Any Specialization...,"Communication Skills, Key Accounts, Account Management, Sales Coordination, Sales Management, Business Development, Marketing",2 Days Ago
544,Sales Jobs,Business Development Representative - Sales - IT,DataGroup Geospatial Technologies Pvt. Ltd.,1-4 Yrs,Not disclosed,Mumbai," Job Nature : Full TimeQualification : B.com.M.com, MBA(Marketing, International Busines...","Business Growth, International Business, Business Development, B2B Sales, Software Sales, New Business, Corporate Sales, Business Development Representative",2 Days Ago
545,Sales Jobs,Senior Sales Manager,Snaphunt,8-13 Yrs,Not disclosed,Bengaluru, You have a Degree from a top-tier institute and least 8 years experience within a B2B s...,"Business Planning, Profitability, Business Plan Development, Key Accounts, Sales Strategy, Strategic Marketing, B2B Sales, Sales Management",2 Days Ago
546,Sales Jobs,Business Development/sr BD (inside Sales)-night Shift (US Market,Compunnel Technology India Private Limited,2-7 Yrs,Not disclosed,Noida, Candidate should be comfortable with night shift- US timingsInternet savvy and experien...,"B2b sales, Inside Sales, US Sales, Email Marketing, IT Sales, technology sales, International Sales, Cloud Sales",2 Days Ago
547,Sales Jobs,Sales Role - International Business Development,Advids.co,0-2 Yrs,Not disclosed,Pune, Required Candidate profileDesired Skills and Experience : - Effective Communication and...,"International Sales, Sales, Marketing Services Sales, Direct Sales, Key Account Management, Client Engagement, Business Development, B2B Sales",2 Days Ago
548,Sales Jobs,Hiring International Sales Manager - Inside Sales in Noida 58,NCR Eduservices Pvt. Ltd.,4-9 Yrs,Not disclosed,Noida," Hi, We are hiring for an International Sales Manager - Inside Sales About the Company :...","international sales, bpo, ites, australia, business development, bdm, market research, pre publishing",2 Days Ago
549,Sales Jobs,Required Sr. Exe. - Institutional Sales and Marketing in Shalby Ltd.,Shalby Limited,1-6 Yrs,"2,00,000 - more than 3,00,000 PA.","Ahmedabad, Mohali, Jaipur", Sourcing candidates/Marketing Activities Sourcing of students from different institutes...,"Procurement, Educational Sales, BD, Lead Generation, Promotions, Corporate HR, Data Maintenance, Institutional Sales",None
550,Sales Jobs,Business Development Executive / Sales Manager,Aosta Overseas Careers,2-7 Yrs,Not disclosed,"Germany, Canada, Australia", Business Development Executives / sales manager Oversee the sales process to attract ne...,"Sales Process, relationship management process, Sales Management, Business Development, client servicing process, marketing process, business development process, Sales Executive Activities",None
551,Sales Jobs,Area Sales Manager,Orion Edutech Private Limited,10-13 Yrs,"9,50,000 - 10,00,000 PA.","Patna, Raipur, Visakhapatnam", Required Qualification: - Education: MBA- From Top B School Should have regular contact...,"Appoint, Area Sales Management, Region, Distribution Network, Business Development, Regional Sales, General Trade, Marketing",None
552,Secretary Jobs,Executive Secretary,Expogroup,0-1 Yrs,Not disclosed,India, Requirement: Females between 24 - 28 years good in multitasking capabilities Internet C...,"Business correspondence, Executive Secretary",None
553,Secretary Jobs,"Urgently Looking For EA, Personal Secretary, PA @ Thane",Saarathi Healthcare Pvt. Ltd.,1-3 Yrs,"2,50,000 - 4,00,000 PA.",Thane, * Preferred Male candidate* Only from central Line candidates are eligible for thisProf...,"personal secretary to director, correspondence, accounting, business administration, excel, pa, travel arrangements, Executive assistant to CEO",None
554,Secretary Jobs,Executive Secretary,GlaxoSmithKline Pharmaceuticals Limited,4-5 Yrs,Not disclosed,Mumbai," Job Purpose : Provide Secretarial support to Executive Vice President, Regulatory as we...","Procurement, Administration, Data management, Executive Vice President, Project management, Healthcare, HR, Regulatory affairs",3 Days Ago
555,Secretary Jobs,Personal Secretary,ShivindaN Construction Pvt. Limited,5-10 Yrs,Not disclosed,Ghaziabad, Required Candidate profile Good oral and written communication skills Excellent communi...,"PA, secretary, Personal Secretary",4 Days Ago
556,Secretary Jobs,"Personal Secretary- WSP, Bengaluru (6 Months Contractual role)",WSP CONSULTANTS INDIA PRIVATE LIMITED,3-6 Yrs,Not disclosed,Bengaluru, WSP is looking immediate joiner for Personal Assistant .Below given is the job Descript...,"personal secretary, Executive Assistant, PA, Personal Assistance, Executive Secretary",4 Days Ago
557,Secretary Jobs,"Executive Assistant ( PA / Secretary ) - Female only @ Vizag, Hospital",HealthCare Global Enterprises Ltd,4-9 Yrs,Not disclosed,Visakhapatnam, Female candidates can applyEducation qualification: GraduationShould have good communic...,"PA, Communication Skills, Travel Arrangements, Excel, Typing, Word, Coordination, Secretarial Activities",5 Days Ago
558,Secretary Jobs,Personal Secretary (2-5 Years Experience) : Visakhapatnam,Shirdi Sai Shipping Private Limited,3-8 Yrs,"2,00,000 - 3,00,000 PA.",Visakhapatnam, Required Candidate profileProficient with MS OfficeGood oral and written communication ...,"personal secretary activities, executive assistant activities, Secretarial Activities, executive secretary activities, pa activities, ps activities, personal assistant activities",5 Days Ago
559,Secretary Jobs,Personal Secretary  -  MALE,Ayan Consultancy,0-1 Yrs,Not disclosed,Bhubaneshwar, Job Description Graduate / Post Graduate (in any Stream) from reputed Govt. College Hav...,"Relationship management, Personal Secretary, Public Relation Executive, Consultancy, Recruitment",9 Days Ago
560,Secretary Jobs,Urgent Requirement of Executive Secretary - Pune,Modern Education Society,2-7 Yrs,Not disclosed,Pune, Qualifications: Graduate with good academic track recordShe should be able to independe...,"Executive Assistant, Administration, executive assistant activities, ea activities, Education, Personal Secretary, Secretarial Activities, College",8 Days Ago
561,Secretary Jobs,Executive Assistant/ Secretary,Zobbs,2-7 Yrs,Not disclosed,Mumbai, We are hiring for a Executive Assistant/ Secretary for one of our client.Experience: 1 ...,"Executive Assistant, pa, executive secretary, Secretary, secretarial activities, EA",15 Days Ago
562,Secretary Jobs,Personal Secretary Female,Concrete LogicaL,1-6 Yrs,"3,00,000 - 6,00,000 PA.","Delhi NCR, Gurgaon"," Job Description for the post of Personal Secretary to The MD at Concrete LogicaL , Gurg...","Office Administration, Travel Arrangements, Sales, Negotiation Skills, Secretarial Activities, Correspondence, Advanced Excel, Dealing",14 Days Ago
563,Secretary Jobs,Personal Secretary,Infinity Group,3-6 Yrs,Not disclosed,Noida, Position: Personal Secretary Education: Post Graduate Experience: 3years+ Job Location:...,"Management Executive, Team management, Event management, Office equipment, management, Project management, Personal Secretary, SMS",9 Days Ago
564,Secretary Jobs,Personal Secretary - HO,Ansal Housing and Construction Ltd,5-10 Yrs,Not disclosed,Delhi NCR, Roles and responsibilities 1.Arranging Meetings with the departments. 2.Arranging trave...,"personal secretary activities, executive assistant activities, Secretarial Activities, Accommodation, Maintenance, secretary activities, personal assistant activities",12 Days Ago
565,Secretary Jobs,Personal Secretary,Infinity Group,1-6 Yrs,Not disclosed,Delhi, : 1. Must have handling experience as a personal secretary. 2. Co-ordinate and arrange ...,"Shorthand, Management Executive, management, Personal Secretary, Service industry, query, SMS, Security services",9 Days Ago
566,Secretary Jobs,CEO Secretary // Mumbai,Adecco India Private Limited,1-4 Yrs,"1,00,000 - 4,00,000 PA.",Mumbai, Qualification required:- Any Graduate Qualification: Minimum a GraduateJob Requirement:...,"Administration, Excel, Word, Typing Speed, Accounting, Travel Planning, Office Skills, Secretarial Activities",None
567,Secretary Jobs,Personal Assistant / Secretary/ Executive Assistant_female Candidate,Zobbs,1-6 Yrs,Not disclosed,Mumbai, We are hiring for a Executive Assistant/ Secretary for one of our client. Experience: 1...,"pa, Executive assistant, Good Communication Skills, secretary, personal assistant, ea",5 Days Ago
568,Secretary Jobs,Job| Executive Secretary To COO,Wow Jobs (Wow Softech Pvt. Ltd),10-15 Yrs,Not disclosed,Nigeria, Completes a broad variety of administrative tasks for the COO and other operations exec...,"Administration, Investor Relations, Secretarial Activities, Strong Interpersonal Skills, Correspondence, Operations, Communication",5 Days Ago
569,Secretary Jobs,Personal secretary For MD For leading company,HR Consultant,2-7 Yrs,"2,00,000 - 5,00,000 PA.",Chennai," Personal Secretary:Location: ChennaiSalary: Rs. 25, 000/- to 40000pmAppearance: Present...","Executive assistant, Front office, Personal assistant, Secretary, Executive secretary",9 Days Ago
570,Secretary Jobs,Secretary To MD - Pharma,RNM Consultants,5-10 Yrs,Not disclosed,"Mumbai, Lower Parel", Self correspondence on various matters .Screening emails-reply to emailsArranging meeti...,"Executive Assistant, Secretary, Meeting, Secretarial Activities, Secretarial Operations, Correspondence, Travel Booking, Booking",10 Days Ago
571,Corporate Planning Jobs,Manager -  Corporate Planning & Strategy,A2Z INFRA ENGINEERING LIMITED,5-10 Yrs,Not disclosed,Gurgaon, Coordinating and integrating unit activities so they conform to organizational strategi...,"New, distinctive, Corporate, Developing, competencies, Planning, Entries",30+ Days Ago
572,Corporate Planning Jobs,Corporate Planning / Strategy Mgr,Salient HR Management Pvt. Ltd.,6-13 Yrs,Not disclosed,"Delhi, Bhopal, Indore, Gwalior"," Sr. Manager - Six Sigma No of opening: Location: Bhopal , Delhi , Gwalior , Indore Educ...","Retail, Education, Consulting, Corporate planning, Six sigma",30+ Days Ago
573,Corporate Planning Jobs,Business Analyst-strategist- Pharmaceutical Industry-corporate Plan,M/S Global Tech Solutions,3-5 Yrs,"15,00,000 - 20,00,000 PA.","Bengaluru, Hyderabad"," 1.Provide support to CEO in steering key organisation projects, digital & strategic tra...","digital initiatives, pharmaceutical industry, strategic business process modelling, corporate planning, financial due diligence, finance modelling, competitive intelligence, business intelligence",15 Days Ago
574,Corporate Planning Jobs,Required Quality Assurance and Analys For  Canada,Genuine Immigration Service,3-8 Yrs,"50,000 - 70,000 PA.","Canada, Australia", Quality assurance Manager and Analyst are in high demand in Canadian Employers. If you ...,"management consulting, six sigma consultant, iso internal control, iso coordinator, corporate planning, iso operational risk, iso internal auditor, business consulting",12 Days Ago
575,Corporate Planning Jobs,Strategy Head Role!!,Bliss GVS Pharma Ltd.,20-30 Yrs,Not disclosed,Mumbai, Proficient in managing business operations encompassing customer relationship managemen...,"Business Strategy, Market Penetration, International Marketing, Strategic Management, New Market Development, Strategic Marketing, Compitit, Strategic Planning",19 Days Ago
576,Corporate Planning Jobs,EA to Director - Hospet,Busisol Sourcing (India) Pvt. Ltd.,3-5 Yrs,Not disclosed,Hospet, Corporate Planning Strategic and annual business planning; financial analysis to back k...,"ERP, Business analysis, Financial analysis, Analytical, Corporate planning, Business planning, Financial modelling, Secondary research",30+ Days Ago
